category,title,price,original_price,sale_price,discount,variant,product_url,image_url,brand
men,Red Gold Latha Unstitched Fabric Cotton-LF,"fromRs.3,488","Rs.6,975","fromRs.3,488",-50%,"Off White, Black, White",https://www.gulahmedshop.com/products/red-gold-latha-unstitched-fabric-cotton-lf,https://www.gulahmedshop.com/cdn/shop/files/red-gold-latha-ns-unstitched-fabric-cotton-black-fullshot-side2_165x.jpg?v=1758382708,GulAhmed
men,White Basic Pajama PJ-BLD23-002,"Rs.1,226","Rs.2,042","Rs.1,226",-40%,"Small, Medium, Large",https://www.gulahmedshop.com/products/white-basic-pajama-pj-bld23-002,https://www.gulahmedshop.com/cdn/shop/files/white_basic_pajama_pj-bld23-002_3__1_165x.jpg?v=1758382827,GulAhmed
men,Summer Cool Unstitched Fabric Cotton with Gift Box,"fromRs.2,640","Rs.5,278","fromRs.2,640",-40%,"Black, White, Dark Grey",https://www.gulahmedshop.com/products/summer-cool-unstitched-fabric-cotton-with-gift-box,https://www.gulahmedshop.com/cdn/shop/files/314615_1_165x.jpg?v=1758382195,GulAhmed
men,Chairman Latha Unstitched Fabric Cotton-LF,"Rs.5,600",,"Rs.5,600",0,Default Title,https://www.gulahmedshop.com/products/chairman-latha-unstitched-fabric-cotton-lf,https://www.gulahmedshop.com/cdn/shop/files/chairman_latha_unstitched_fabric_cotton-lf_5_165x.jpg?v=1758383869,GulAhmed
men,Mustard Unstitched Fabric Gift Box,Rs0.55,,Rs0.55,0,Default Title,https://www.gulahmedshop.com/products/mustard-unstitched-fabric-gift-box,N/A,GulAhmed
men,Luquia Unstitched Fabric Blended with Gift Box,"fromRs.4,494","Rs.7,490","fromRs.4,494",-40%,"Black, White, Royal Blue",https://www.gulahmedshop.com/products/luquia-unstitched-fabric-blended-with-gift-box,N/A,GulAhmed
men,Gul Makhmal Unstitched Fabric Blended-LF,"Rs.3,942","Rs.6,570","Rs.3,942",-40%,"Navy, Grey Green, Off White",https://www.gulahmedshop.com/products/gul-makhmal-unstitched-fabric-blended-lf,N/A,GulAhmed
men,Leader Latha Unstitched Fabric Cotton-LF,"fromRs.3,850","Rs.7,700","fromRs.3,850",-50%,"Onyx Black, Deep Cobalt, Off White",https://www.gulahmedshop.com/products/leader-latha-unstitched-fabric-cotton-lf,N/A,GulAhmed
men,Gul 900 Crescent Unstitched Fabric Blended-LF,"Rs.3,645","Rs.6,075","Rs.3,645",-40%,"Off White, Black, White",https://www.gulahmedshop.com/products/gul-900-crescent-unstitched-fabric-blended-lf,N/A,GulAhmed
men,Sky Blue Esso Latha Unstitched Fabric,"Rs.3,850","Rs.7,700","Rs.3,850",-50%,Default Title,https://www.gulahmedshop.com/products/sky-blue-esso-latha-unstitched-fabric,N/A,GulAhmed
men,Bemisaal Flair Unstitched Fabric Blended-LF,"Rs.3,096","Rs.5,158","Rs.3,096",-40%,"Off White, Black, White",https://www.gulahmedshop.com/products/bemisaal-flair-unstitched-fabric-blended-lf,N/A,GulAhmed
men,Gul 900 Castor Unstitched Fabric Blended-LF,"Rs.4,190","Rs.5,985","Rs.4,190",-30%,"Kai Green, Ash Grey, Green",https://www.gulahmedshop.com/products/gul-900-castor-unstitched-fabric-blended-lf,N/A,GulAhmed
men,Regular Fit Embroidered Suits SK-BSC25-040,"Rs.5,593","Rs.7,990","Rs.5,593",-30%,"Small, Medium, Large",https://www.gulahmedshop.com/products/regular-fit-embroidered-suits-sk-bsc25-040,N/A,GulAhmed
men,Mirus Unstitched Fabric Blended-LF,"Rs.2,898","Rs.4,136","Rs.2,898",-30%,"Off White, Black, White",https://www.gulahmedshop.com/products/mirus-unstitched-fabric-blended-lf,N/A,GulAhmed
men,Vision Opera Unstitched Fabric Blended-LF,"Rs.3,411","Rs.5,679","Rs.3,411",-40%,"Brown, Green, Purple",https://www.gulahmedshop.com/products/vision-opera-unstitched-fabric-blended-lf,N/A,GulAhmed
men,Radiant Unstitched Fabric Blended with Gift Box,"Rs.6,318","Rs.10,530","Rs.6,318",-40%,"Ash Grey, Grey, Sea Green",https://www.gulahmedshop.com/products/radiant-unstitched-fabric-blended-with-gift-box,N/A,GulAhmed
men,White Basic Smart Casual SC-YD22-007,"Rs.1,000","Rs.3,682","Rs.1,000",-73%,"Small, Medium, Large",https://www.gulahmedshop.com/products/white-basic-smart-casual-sc-yd22-007,https://www.gulahmedshop.com/cdn/shop/files/white_basic_smart_casual_sc-yd22-007_1_165x.jpg?v=1758382405,GulAhmed
men,Navy Basic Non Denim Jeans TR-NDJ22-012,Rs0.99,"Rs.3,998",Rs0.99,-75%,"30X32, 32X32, 34X32",https://www.gulahmedshop.com/products/navy-basic-non-denim-jeans-tr-ndj22-012,https://www.gulahmedshop.com/cdn/shop/files/navy_basic_non_denim_jeans_tr-ndj22-012_7_165x.jpg?v=1758382521,GulAhmed
men,Mega Super Unstitched Fabric Blended-LF,"Rs.3,780","Rs.6,300","Rs.3,780",-40%,"Off White, Black, White",https://www.gulahmedshop.com/products/mega-super-unstitched-fabric-blended-lf,https://www.gulahmedshop.com/cdn/shop/files/273265_6_165x.jpg?v=1758382999,GulAhmed
men,Gul 900 Snow Drop Unstitched Fabric Blended-LF,"Rs.3,798","Rs.6,326","Rs.3,798",-40%,"Off White, White, Light Grey",https://www.gulahmedshop.com/products/gul-900-snow-drop-unstitched-fabric-blended-lf,https://www.gulahmedshop.com/cdn/shop/files/388123-abc_1_165x.jpg?v=1758383210,GulAhmed
men,Basic Shalwar SH-BLD24-001,"Rs.1,074","Rs.1,790","Rs.1,074",-40%,"Small, Medium, Large",https://www.gulahmedshop.com/products/basic-shalwar-sh-bld24-001,https://www.gulahmedshop.com/cdn/shop/files/men-ethnic-shalwar-color-white-blended--regular-fit-sh-bld24-001-half-front_165x.jpg?v=1758383429,GulAhmed
men,White Basic Shalwar SH-CTN24-001,"Rs.1,229","Rs.2,047","Rs.1,229",-40%,"Small, Medium, Large",https://www.gulahmedshop.com/products/white-basic-shalwar-sh-ctn24-001,https://www.gulahmedshop.com/cdn/shop/files/white_basic_shalwar_sh-ctn24-001_1__1_165x.jpg?v=1758383198,GulAhmed
men,Britanio Unstitched Fabric Cotton-LF,"fromRs.3,002","Rs.6,669","fromRs.3,002",-50%,"Off White, Black, White",https://www.gulahmedshop.com/products/britanio-unstitched-fabric-cotton-lf,N/A,GulAhmed
men,Classic Latha Unstitched Fabric Cotton-LF,"fromRs.4,340","Rs.8,680","fromRs.4,340",-50%,"Bracken, Off White, Black",https://www.gulahmedshop.com/products/classic-latha-unstitched-fabric-cotton-lf,N/A,GulAhmed
men,Adore Unstitched Fabric Blended-LF,"fromRs.2,795","Rs.3,992","fromRs.2,795",-30%,"Off White, Black, White",https://www.gulahmedshop.com/products/adore-unstitched-fabric-blended-lf,N/A,GulAhmed
men,Gul 900 Tornado Unstitched Fabric Blended with Gift Box,"Rs.5,142","Rs.8,570","Rs.5,142",-40%,"Purple, Dark Brown, Maroon",https://www.gulahmedshop.com/products/gul-900-tornado-unstitched-fabric-blended-with-gift-box,N/A,GulAhmed
men,Pure Boski Original Unstitched Fabric Silk with Gift Box,"Rs.25,991","Rs.43,317","Rs.25,991",-40%,Cream,https://www.gulahmedshop.com/products/pure-boski-original-unstitched-fabric-silk-with-gift-box,N/A,GulAhmed
men,Sea Blue Unstitched Fabric Shirt Denim Club-F,"Rs.1,206","Rs.2,676","Rs.1,206",-55%,Default Title,https://www.gulahmedshop.com/products/sea-blue-unstitched-fabric-shirt-denim-club-f,N/A,GulAhmed
men,Black Gold Latha Unstitched Fabric Cotton,"fromRs.4,288","Rs.8,575","fromRs.4,288",-50%,"Black, Dark Grey, Ink Blue",https://www.gulahmedshop.com/products/black-gold-latha-unstitched-fabric-cotton,N/A,GulAhmed
men,Vision Figo Unstitched Fabric Blended,"Rs.5,915","Rs.8,450","Rs.5,915",-30%,"Cream, Light Grey, Silver Grey",https://www.gulahmedshop.com/products/vision-figo-unstitched-fabric-blended,N/A,GulAhmed
men,Black Gold Latha Unstitched Fabric Cotton-LF,"fromRs.4,116","Rs.8,225","fromRs.4,116",-50%,"Deep Cobalt, Bracken, Black",https://www.gulahmedshop.com/products/black-gold-latha-unstitched-fabric-cotton-lf,https://www.gulahmedshop.com/cdn/shop/files/380321_1_165x.jpg?v=1758383063,GulAhmed
men,Sky Blue Unstitched Fabric LEADER LATHA,"Rs.3,850","Rs.7,700","Rs.3,850",-50%,Default Title,https://www.gulahmedshop.com/products/sky-blue-unstitched-fabric-leader-latha,https://www.gulahmedshop.com/cdn/shop/files/m2a4610_2_165x.jpg?v=1758383673,GulAhmed
men,Regular Fit Basic Suits SK-FRIBC25-004,"Rs.4,290",,"Rs.4,290",0,"Small, Medium, Large",https://www.gulahmedshop.com/products/regular-fit-basic-suits-sk-fribc25-004,https://www.gulahmedshop.com/cdn/shop/files/men-suits-color-grey-blended-regular-fit-sk-fribc25-004-front_165x.jpg?v=1758383528,GulAhmed
men,Gul Capri Latha Unstitched Fabric Cotton-LF,"fromRs.3,927","Rs.7,850","fromRs.3,927",-50%,"Navy, Deep Cobalt, Bracken",https://www.gulahmedshop.com/products/gul-capri-latha-unstitched-fabric-cotton-lf,https://www.gulahmedshop.com/cdn/shop/files/302464_1__1_165x.jpg?v=1758382340,GulAhmed
men,GUL 90000 Ultra Soft Unstitched Fabric Cotton-LF,"fromRs.3,240","Rs.7,200","fromRs.3,240",-40%,"Off White, Black, White",https://www.gulahmedshop.com/products/gul-90000-ultra-soft-unstitched-fabric-cotton-lf,https://www.gulahmedshop.com/cdn/shop/files/314593_2_165x.jpg?v=1758382306,GulAhmed
men,Opus Charisma Unstitched Fabric Blended with Gift Box,"Rs.6,944","Rs.9,920","Rs.6,944",-30%,"Dark Purple, Purple, Dark Green",https://www.gulahmedshop.com/products/opus-charisma-unstitched-fabric-blended-with-gift-box,https://www.gulahmedshop.com/cdn/shop/files/opus_charisma_unstitched_fabric_blended_with_gift_box-purple_4_165x.jpg?v=1758383336,GulAhmed
men,Excel Fine Classic Unstitched Fabric Cotton with Gift Box,"Rs.5,648","Rs.12,550","Rs.5,648",-55%,"Off White, Kai Green, Silver Grey",https://www.gulahmedshop.com/products/excel-fine-classic-unstitched-fabric-cotton-with-gift-box,N/A,GulAhmed
men,Regular Fit Styling Suits SK-S24-109,"Rs.5,694","Rs.9,490","Rs.5,694",-40%,"Small, Medium, Large",https://www.gulahmedshop.com/products/regular-fit-styling-suits-sk-s24-109,N/A,GulAhmed
men,Basic Waistcoat WC-PD24-040,"Rs.5,993","Rs.7,990","Rs.5,993",-25%,"Small, Medium, Large",https://www.gulahmedshop.com/products/basic-waistcoat-wc-pd24-040,N/A,GulAhmed
men,Styling Suits SK-S24-127,"Rs.5,993","Rs.7,990","Rs.5,993",-25%,"Small, Medium, Large",https://www.gulahmedshop.com/products/styling-suits-sk-s24-127,N/A,GulAhmed
men,White Basic Shalwar SH-CTN23-002,"Rs.1,262","Rs.2,102","Rs.1,262",-40%,"Small, Medium, Large",https://www.gulahmedshop.com/products/white-basic-shalwar-sh-ctn23-002,N/A,GulAhmed
men,Libas e Khas Unstitched Fabric Cotton-LF,"Rs.3,546","Rs.7,875","Rs.3,546",-55%,"Black, White, Sky Blue",https://www.gulahmedshop.com/products/libas-e-khas-unstitched-fabric-cotton-lf,N/A,GulAhmed
men,Green Basic Waistcoat WC-PD24-032,"Rs.3,587","Rs.7,172","Rs.3,587",-50%,"Small, Medium, Large",https://www.gulahmedshop.com/products/green-basic-waistcoat-wc-pd24-032,N/A,GulAhmed
men,Suri Latha Unstitched Fabric Cotton-LF,"fromRs.4,025","Rs.8,050","fromRs.4,025",-50%,"Bracken, Off White, Black",https://www.gulahmedshop.com/products/suri-latha-unstitched-fabric-cotton-lf,N/A,GulAhmed
men,Hitex Plus Unstitched Fabric Cotton with Gift Box,"fromRs.7,951","Rs.17,667","fromRs.7,951",-55%,"Navy, Off White, Black",https://www.gulahmedshop.com/products/hitex-plus-unstitched-fabric-cotton-with-gift-box,N/A,GulAhmed
men,Gul 900 Poshak Unstitched Fabric Blended-LF,"fromRs.2,390","Rs.3,983","fromRs.2,390",-40%,"Black, White, Dark Grey",https://www.gulahmedshop.com/products/gul-900-poshak-unstitched-fabric-blended-lf,N/A,GulAhmed
men,Hitex Twill Plus Unstitched Fabric Cotton with Gift Box,"fromRs.8,168","Rs.18,150","fromRs.8,168",-50%,"Off White, Black, White",https://www.gulahmedshop.com/products/hitex-twill-plus-unstitched-fabric-cotton-with-gift-box,https://www.gulahmedshop.com/cdn/shop/files/311130-abc_1_165x.jpg?v=1758383042,GulAhmed
men,Elite Unstitched Fabric Blended with Gift Box,"Rs.7,076","Rs.10,886","Rs.7,076",-35%,"Black, Dark Grey, Chocolate Brown",https://www.gulahmedshop.com/products/elite-unstitched-fabric-blended-with-gift-box,https://www.gulahmedshop.com/cdn/shop/files/278238-abc_3_165x.jpg?v=1758383186,GulAhmed
men,Gul 900 Blue Bell Unstitched Fabric Blended-LF,"Rs.3,605","Rs.6,003","Rs.3,605",-40%,"Off White, White, Light Grey",https://www.gulahmedshop.com/products/gul-900-blue-bell-unstitched-fabric-blended-lf,https://www.gulahmedshop.com/cdn/shop/files/390653-abc_1_165x.jpg?v=1758383208,GulAhmed
men,GUL 90 Fresher Unstitched Fabric Blended with Gift Box,"Rs.4,932","Rs.8,220","Rs.4,932",-40%,"Off White, Black, White",https://www.gulahmedshop.com/products/gul-90-fresher-unstitched-fabric-blended-with-gift-box,https://www.gulahmedshop.com/cdn/shop/files/388185-abc_3_165x.jpg?v=1758383190,GulAhmed
men,Vision Dominant Unstitched Fabric Blended-LF,"Rs.3,780","Rs.6,300","Rs.3,780",-40%,"Black, White, Cream",https://www.gulahmedshop.com/products/vision-dominant-unstitched-fabric-blended-lf,https://www.gulahmedshop.com/cdn/shop/files/393213-abc_1_165x.jpg?v=1758383251,GulAhmed
men,Embroidered Collection FD C001 Unstitched Fabric Cotton with Gift Box,"Rs.9,229","Rs.20,507","Rs.9,229",-55%,"Sky Blue, Grey, Light Purple",https://www.gulahmedshop.com/products/embroidered-collection-fd-c001-unstitched-fabric-cotton-with-gift-box,https://www.gulahmedshop.com/cdn/shop/files/bg5a8829_165x.jpg?v=1758383132,GulAhmed
men,Spectrum Unstitched Fabric Cotton,"Rs.5,828","Rs.12,950","Rs.5,828",-55%,"Off White, White, Cream",https://www.gulahmedshop.com/products/spectrum-unstitched-fabric-cotton,N/A,GulAhmed
men,Ambitious Cotton Unstitched Fabric Cotton-LF,"Rs.3,951","Rs.8,775","Rs.3,951",-55%,"Off White, Black, White",https://www.gulahmedshop.com/products/ambitious-cotton-unstitched-fabric-cotton-lf,N/A,GulAhmed
men,Bemisaal Admire Unstitched Fabric Blended-LF,"Rs.3,375","Rs.5,625","Rs.3,375",-40%,"Black, Grey, Beige",https://www.gulahmedshop.com/products/bemisaal-admire-unstitched-fabric-blended-lf,N/A,GulAhmed
men,Regular Fit Styling Kurta KR-STY25-022,"Rs.3,493","Rs.4,990","Rs.3,493",-30%,"Small, Medium, Large",https://www.gulahmedshop.com/products/regular-fit-styling-kurta-kr-sty25-022,N/A,GulAhmed
men,Regular Fit Basic Suits SK-FRISC25-004,"Rs.4,290",,"Rs.4,290",0,"Small, Medium, Large",https://www.gulahmedshop.com/products/regular-fit-basic-suits-sk-frisc25-004,N/A,GulAhmed
men,Regular Fit Styling Pajama PJ-BLD24-001A,"Rs.1,494","Rs.2,490","Rs.1,494",-40%,"Small, Medium, Large",https://www.gulahmedshop.com/products/regular-fit-styling-pajama-pj-bld24-001a,N/A,GulAhmed
men,Styling Waist Coat WC-STY25-011,"Rs.6,293","Rs.8,990","Rs.6,293",-30%,"Small, Medium, Large",https://www.gulahmedshop.com/products/styling-waist-coat-wc-sty25-011,N/A,GulAhmed
men,Styling Suits SK-S24-110,"Rs.5,694","Rs.9,490","Rs.5,694",-40%,"Small, Medium, Large",https://www.gulahmedshop.com/products/styling-suits-sk-s24-110,N/A,GulAhmed
men,Styling Suits SK-WCS24-001,"Rs.12,743","Rs.16,990","Rs.12,743",-25%,"Small, Medium, Large",https://www.gulahmedshop.com/products/styling-suits-sk-wcs24-001,https://www.gulahmedshop.com/cdn/shop/files/styling_suits_sk-wcs24-001_165x.jpg?v=1758383336,GulAhmed
men,White Basic Mens Shalwar SH-CTN22-002,"Rs.1,135","Rs.1,891","Rs.1,135",-40%,"Small, Medium, Large",https://www.gulahmedshop.com/products/white-basic-mens-shalwar-sh-ctn22-002,https://www.gulahmedshop.com/cdn/shop/files/white_basic_mens_shalwar_sh-ctn22-002_5_165x.jpg?v=1758382537,GulAhmed
men,Supreme Latha Unstitched Fabric Cotton S-LF,"Rs.3,850","Rs.7,700","Rs.3,850",-50%,"Off White, White, Cream",https://www.gulahmedshop.com/products/supreme-latha-unstitched-fabric-cotton-s-lf,https://www.gulahmedshop.com/cdn/shop/files/412058-abc_6_165x.jpg?v=1758383411,GulAhmed
men,GUL 90 FRESHER Unstitched Fabric Blended-LF,"Rs.4,154","Rs.6,917","Rs.4,154",-40%,"Off White, Black, Dark Grey",https://www.gulahmedshop.com/products/gul-90-fresher-unstitched-fabric-blended-lf,https://www.gulahmedshop.com/cdn/shop/files/296343_6_165x.jpg?v=1758382015,GulAhmed
men,X-Series Coral Unstitched Fabric Cotton with Gift Box,"Rs.12,650","Rs.25,300","Rs.12,650",-50%,"Off White, Black, White",https://www.gulahmedshop.com/products/x-series-coral-unstitched-fabric-cotton-with-gift-box,https://www.gulahmedshop.com/cdn/shop/files/263169_6_165x.jpg?v=1758382758,GulAhmed
men,Hitex Cool Plus Unstitched Fabric Cotton with Gift Box,"fromRs.4,091","Rs.9,090","fromRs.4,091",-50%,"Off White, White, Silver Grey",https://www.gulahmedshop.com/products/hitex-cool-plus-unstitched-fabric-cotton-with-gift-box,https://www.gulahmedshop.com/cdn/shop/files/289075_3_165x.jpg?v=1758383000,GulAhmed
men,Light Brown MEGA SUPER O/S Unstitched Fabric,"Rs.3,780","Rs.6,300","Rs.3,780",-40%,Default Title,https://www.gulahmedshop.com/products/light-brown-mega-super-o-s-unstitched-fabric,N/A,GulAhmed
men,Green Styling Suit SK-S24-039,"Rs.4,304","Rs.7,172","Rs.4,304",-40%,"Small, Medium, Large",https://www.gulahmedshop.com/products/green-styling-suit-sk-s24-039,N/A,GulAhmed
men,Gini Gold Unstitched Fabric Blended,"Rs.5,412","Rs.9,020","Rs.5,412",-40%,"Navy, Off White, Black",https://www.gulahmedshop.com/products/gini-gold-unstitched-fabric-blended,N/A,GulAhmed
men,Cotton Club Plus Unstitched Fabric Cotton With Gift Box,"fromRs.6,325","Rs.14,055","fromRs.6,325",-50%,"Navy, Off White, Black",https://www.gulahmedshop.com/products/cotton-club-plus-unstitched-fabric-cotton-with-gift-box,N/A,GulAhmed
men,Opus Wonderer Unstitched Fabric Blended,"Rs.5,789","Rs.8,270","Rs.5,789",-30%,"Navy, Off White, Black",https://www.gulahmedshop.com/products/opus-wonderer-unstitched-fabric-blended,N/A,GulAhmed
men,Shahtaj Latha Unstitched Fabric Cotton-LF,"fromRs.4,025","Rs.8,050","fromRs.4,025",-50%,"Onyx Black, Bracken, Off White",https://www.gulahmedshop.com/products/shahtaj-latha-unstitched-fabric-cotton-lf,N/A,GulAhmed
men,Platinum Latha Unstitched Fabric Cotton-LF,"fromRs.3,962","Rs.7,917","fromRs.3,962",-50%,"Deep Cobalt, Bracken, Off White",https://www.gulahmedshop.com/products/platinum-latha-unstitched-fabric-cotton-lf,N/A,GulAhmed
men,Embroidered Collection FD C003 Unstitched Fabric Cotton with Gift Box,"Rs.9,229","Rs.20,507","Rs.9,229",-55%,"Sky Blue, Grey, Light Purple",https://www.gulahmedshop.com/products/embroidered-collection-fd-c003-unstitched-fabric-cotton-with-gift-box,N/A,GulAhmed
men,Bannu Donigal Unstitched Fabric Blended with Gift Box,"Rs.11,778","Rs.16,825","Rs.11,778",-30%,"Chocolate Brown, Royal Blue, Grey",https://www.gulahmedshop.com/products/bannu-donigal-unstitched-fabric-blended-with-gift-box,N/A,GulAhmed
men,Gul 900 Lomani Unstitched Fabric Blended-LF,"Rs.4,788","Rs.6,840","Rs.4,788",-30%,"Dark Grey, Chocolate Brown, Stone",https://www.gulahmedshop.com/products/gul-900-lomani-unstitched-fabric-blended-lf,N/A,GulAhmed
men,Vision Mirzam Unstitched Fabric Blended with Gift Box,"Rs.5,950","Rs.8,500","Rs.5,950",-30%,"Chocolate Brown, Leaf Green, Onion",https://www.gulahmedshop.com/products/vision-mirzam-unstitched-fabric-blended-with-gift-box,https://www.gulahmedshop.com/cdn/shop/files/vision_mirzam_unstitched_fabric_blended_with_gift_box-onion_4_165x.jpg?v=1758383372,GulAhmed
men,Vanguard Unstitched Fabric Blended,"Rs.4,788","Rs.7,980","Rs.4,788",-40%,"Black, Kai Green, Chocolate Brown",https://www.gulahmedshop.com/products/vanguard-unstitched-fabric-blended,https://www.gulahmedshop.com/cdn/shop/files/vanguard-g-unstitched-fabric-washnwear-dark-brown-fullshot-front02_165x.jpg?v=1758383510,GulAhmed
men,Gul 900 Tornado Unstitched Fabric Blended,"Rs.4,452","Rs.7,420","Rs.4,452",-40%,"Purple, Dark Brown, Maroon",https://www.gulahmedshop.com/products/gul-900-tornado-unstitched-fabric-blended,https://www.gulahmedshop.com/cdn/shop/files/gul-900-tornado-gs-unstitched-fabric-washnwear-dark-blue-fullshot-front_1_165x.jpg?v=1758383530,GulAhmed
men,White GUL 90 FRESHER,"Rs.4,154","Rs.6,917","Rs.4,154",-40%,Default Title,https://www.gulahmedshop.com/products/white-gul-90-fresher,https://www.gulahmedshop.com/cdn/shop/files/6r3a3903_165x.jpg?v=1758383763,GulAhmed
men,Regular Fit Basic Suits SK-P24-099,"Rs.5,394","Rs.8,990","Rs.5,394",-40%,"Small, Medium, Large",https://www.gulahmedshop.com/products/regular-fit-basic-suits-sk-p24-099,https://www.gulahmedshop.com/cdn/shop/files/men-suits-color-maroon-blended-regular-fit-sk-p24-099-half-front_165x.jpg?v=1758383482,GulAhmed
men,Embroidered Waist Coat WC-PD24-006,"Rs.4,995","Rs.9,990","Rs.4,995",-50%,"Small, Medium, Large",https://www.gulahmedshop.com/products/embroidered-waist-coat-wc-pd24-006,https://www.gulahmedshop.com/cdn/shop/files/whatsapp_image_2025-05-02_at_4.28.36_pm_165x.jpg?v=1758383451,GulAhmed
men,Styling Suits SK-S24-129,"Rs.5,993","Rs.7,990","Rs.5,993",-25%,"Small, Medium, Large",https://www.gulahmedshop.com/products/styling-suits-sk-s24-129,N/A,GulAhmed
men,Basic Suits SK-P24-107,"Rs.5,094","Rs.8,490","Rs.5,094",-40%,"Small, Medium, Large",https://www.gulahmedshop.com/products/basic-suits-sk-p24-107,N/A,GulAhmed
men,Basic Suits SK-P24-103,"Rs.6,743","Rs.8,990","Rs.6,743",-25%,"Small, Medium, Large",https://www.gulahmedshop.com/products/basic-suits-sk-p24-103,N/A,GulAhmed
men,White Basic Shalwar SH-CTN23-001,"Rs.1,262","Rs.2,102","Rs.1,262",-40%,"Small, Medium, Large",https://www.gulahmedshop.com/products/white-basic-shalwar-sh-ctn23-001,N/A,GulAhmed
men,Tanabana Royal HB 06 Unstitched Fabric Cotton with Gift Box,"Rs.6,111","Rs.12,221","Rs.6,111",-50%,"Off White, White, Dark Grey",https://www.gulahmedshop.com/products/tanabana-royal-hb-06-unstitched-fabric-cotton-with-gift-box,N/A,GulAhmed
men,Off White Unstitched Fabric PLATINUM LATHA,"Rs.3,962","Rs.7,917","Rs.3,962",-50%,Default Title,https://www.gulahmedshop.com/products/off-white-unstitched-fabric-platinum-latha,N/A,GulAhmed
men,Prestige Unstitched Fabric Cotton-LF,"fromRs.1,539","Rs.3,418","fromRs.1,539",-50%,"Deep Cobalt, Off White, Black",https://www.gulahmedshop.com/products/prestige-unstitched-fabric-cotton-lf,N/A,GulAhmed
men,Tanabana Royal FG 05 Unstitched Fabric Cotton with Gift Box,"Rs.5,824","Rs.11,646","Rs.5,824",-50%,"Cream, Charcoal, Stone",https://www.gulahmedshop.com/products/tanabana-royal-fg-05-unstitched-fabric-cotton-with-gift-box,N/A,GulAhmed
men,Yellow Basic Kurta KR-STY24-013,"Rs.1,500","Rs.4,607","Rs.1,500",-67%,"Small, Medium, Large",https://www.gulahmedshop.com/products/yellow-basic-kurta-kr-sty24-013,https://www.gulahmedshop.com/cdn/shop/files/yellow_basic_kurta_kr-sty24-013_5_165x.jpg?v=1758383093,GulAhmed
men,Prime Latha Unstitched Fabric Cotton,"Rs.5,120","Rs.8,533","Rs.5,120",-40%,"Navy, Bracken, Praline",https://www.gulahmedshop.com/products/prime-latha-unstitched-fabric-cotton,https://www.gulahmedshop.com/cdn/shop/files/366411_6_165x.jpg?v=1758381921,GulAhmed
men,President Latha Unstitched Fabric Cotton,"fromRs.4,550","Rs.9,100","fromRs.4,550",-50%,"Onyx Black, Navy, Deep Cobalt",https://www.gulahmedshop.com/products/president-latha-unstitched-fabric-cotton,https://www.gulahmedshop.com/cdn/shop/files/301830_1__1_165x.jpg?v=1758381997,GulAhmed
men,Luquia Unstitched Fabric Blended,"fromRs.4,094","Rs.6,823","fromRs.4,094",-40%,"Navy, Off White, Black",https://www.gulahmedshop.com/products/luquia-unstitched-fabric-blended,https://www.gulahmedshop.com/cdn/shop/files/298975_3__1_165x.jpg?v=1758382081,GulAhmed
men,GUL 900 UJALA Unstitched Fabric Blended-LF,"fromRs.3,654","Rs.6,083","fromRs.3,654",-30%,"Off White, Black, White",https://www.gulahmedshop.com/products/gul-900-ujala-unstitched-fabric-blended-lf,https://www.gulahmedshop.com/cdn/shop/files/212529_1__1_165x.jpg?v=1758382128,GulAhmed
men,ESSO Latha Unstitched Fabric Cotton-LF,"fromRs.3,850","Rs.7,700","fromRs.3,850",-50%,"Navy, Deep Cobalt, Citadel",https://www.gulahmedshop.com/products/esso-latha-unstitched-fabric-cotton-lf,https://www.gulahmedshop.com/cdn/shop/files/369289_1__1_165x.jpg?v=1758382804,GulAhmed
men,Titanium Latha Unstitched Fabric Cotton-LF,"fromRs.4,165","Rs.8,330","fromRs.4,165",-50%,"Navy, Deep Cobalt, Cornstalk",https://www.gulahmedshop.com/products/titanium-latha-unstitched-fabric-cotton-lf,N/A,GulAhmed
men,Mega Super Unstitched Fabric Blended with Gift Box,"Rs.4,680","Rs.7,800","Rs.4,680",-40%,"Off White, Black, White",https://www.gulahmedshop.com/products/mega-super-unstitched-fabric-blended-with-gift-box,N/A,GulAhmed
men,Alora Cotton Plus Unstitched Fabric Cotton-LF,"fromRs.5,369","Rs.11,925","fromRs.5,369",-30%,"Off White, Black, White",https://www.gulahmedshop.com/products/alora-cotton-plus-unstitched-fabric-cotton-lf,N/A,GulAhmed
men,Prince Luxury Plus Unstitched Fabric Cotton with Gift Box,"fromRs.9,500","Rs.19,000","fromRs.9,500",-50%,"Black, White, Kai Green",https://www.gulahmedshop.com/products/prince-luxury-plus-unstitched-fabric-cotton-with-gift-box,N/A,GulAhmed
men,Barlowe Unstitched Fabric Blended,"Rs.4,550","Rs.7,583","Rs.4,550",-40%,"Cream, Silver Grey, Ash Grey",https://www.gulahmedshop.com/products/barlowe-unstitched-fabric-blended,N/A,GulAhmed
men,Tanabana Royal HB 07 Unstitched Fabric Cotton with Gift Box,"Rs.6,111","Rs.12,221","Rs.6,111",-50%,"Off White, White, Brown",https://www.gulahmedshop.com/products/tanabana-royal-hb-07-unstitched-fabric-cotton-with-gift-box,N/A,GulAhmed
men,Vision Dominant Unstitched Fabric Blended with Gift Box,"Rs.4,680","Rs.7,800","Rs.4,680",-40%,"Off White, Royal Blue, Navy Blue",https://www.gulahmedshop.com/products/vision-dominant-unstitched-fabric-blended-with-gift-box,N/A,GulAhmed
men,Maximo Classic Unstitched Fabric Cotton-LF,"Rs.4,253","Rs.9,450","Rs.4,253",-55%,"Off White, Black, White",https://www.gulahmedshop.com/products/maximo-classic-unstitched-fabric-cotton-lf,N/A,GulAhmed
men,Eminent Unstitched Fabric Blended with Gift Box,"Rs.8,792","Rs.12,560","Rs.8,792",-30%,"Off White, Black, Dark Grey",https://www.gulahmedshop.com/products/eminent-unstitched-fabric-blended-with-gift-box,N/A,GulAhmed
men,Kinetic Unstitched Fabric Blended with Gift Box,"Rs.6,729","Rs.11,215","Rs.6,729",-40%,"Dark Grey, Chocolate Brown, Royal Blue",https://www.gulahmedshop.com/products/kinetic-unstitched-fabric-blended-with-gift-box,N/A,GulAhmed
men,Dominic Unstitched Fabric Blended with Gift Box,"Rs.6,408","Rs.10,680","Rs.6,408",-40%,"Off White, Dark Grey, Royal Blue",https://www.gulahmedshop.com/products/dominic-unstitched-fabric-blended-with-gift-box,https://www.gulahmedshop.com/cdn/shop/files/dominic-j-unstitched-fabric-washnwear-dark-grey-fullshot-top_1_165x.jpg?v=1758383512,GulAhmed
